ID,Title,Content,Source,PublishedAt
71,"Rate 'rigging' traders say they were scapegoated - now the Supreme Court will decide","The Supreme Court is poised to rule on the cases of two former City traders jailed for rigging interest rates, amid concerns raised by senior politicians that there may have been a series of miscarriages of justice. If the traders are successful in their application - which is opposed by the Serious Fraud Office (SFO) - it could lead to the quashing of all remaining convictions secured in nine criminal trials. Tom Hayes, a former trader at the Swiss bank UBS, became the first banker to be jailed for ""rigging"" interest rates in August 2015. He was accused at the age of 35 by the United States Department of Justice and the Serious Fraud Office of being a ""ringmaster"" of an international fraud conspiracy and sentenced to 14 years in jail. Together with former Barclays trader Carlo Palombo, he is now awaiting a crucial Supreme Court judgement. Hayes and Palombo were among 37 City traders prosecuted for ""manipulating"" the interest rate benchmarks Libor and Euribor, which track the cost of borrowing cash between the banks and are used to set the interest rates on millions of mortgages and commercial loans. In criminal trials on both sides of the Atlantic from 2015 to 2019, 19 were convicted of conspiracy to defraud and nine were sent to jail. As they served time, evidence emerged that central bankers and government officials across the world, including a top adviser at 10 Downing Street at the time, had pressured banks such as theirs to engage in very similar conduct to what they were jailed for – but on a much greater scale. No central banker or government official was prosecuted. Then, soon after they were released after serving their full jail tariffs, a US appeal court decided such conduct wasn't a crime after all; nor even against any rules. The US Department of Justice revoked the charges against Tom Hayes, and the US courts then threw out all similar convictions. Yet in the UK, they remain convicted criminals. The Serious Fraud Office, which prosecuted the cases, says the defendants were convicted of conspiracy to defraud and points to a number of previous unsuccessful attempts to overturn convictions at the Court of Appeal. The Supreme Court's now being asked to decide if judges were wrong to tell juries their conduct was unlawful. If it does so, it could lead to the overturning of all remaining convictions, throwing a global 17-year scandal into reverse. It's also likely to prompt renewed calls for a public inquiry into evidence of much larger interest rate ""rigging"" – ordered from the top of the financial system by central banks and governments worldwide. This is the first time the cases have reached the Supreme Court following public pressure from senior politicians, including former shadow chancellor John McDonnell and former Brexit Secretary David Davis. They have told the BBC they're concerned the traders have been ""scapegoated"" in a scandalous series of miscarriages of justice that runs ""deeper than the Post Office"". They want a public inquiry. What is Libor 'rigging'? What the FTSE 100 or the Dow Jones are to share prices, Libor is to interest rates: an index, updated every day, that tracked the cost of borrowing cash between the banks from 1986 until 2024. Each day at 11am, 16 banks across London would answer a question: at what interest rate could they borrow money? Before answering, traders on the banks' cash desks would look at the range of interest rates at which other banks on the market were offering to lend cash, which normally differed from each other by just one or two hundredths of a percentage point (e.g. HSBC offering to lend funds at 3.14%, Bank of China at 3.16%, JP Morgan at 3.15%). Each bank would then select a rate from that range of offers to submit as their answer. An average would then be taken to get the official benchmark, Libor (London Interbank Offered Rate). A similar process was used to get Euribor, the equivalent of Libor for euros. The evidence against Hayes and Palombo were messages they had sent to the cash traders asking them to select a 'high' or 'low' rate from that range, depending on what might benefit their banks' trades – which went up or down in value linked to Libor (or Euribor). Their requests might make no difference to the average; or they might nudge it very slightly in their bank's favour – up or down by no more than one eighth of one hundredth of a percentage point (0.00125%). But it was seen as worth the effort of making the requests, which had been industry practice for years, in case it might help their bank make more money or lose less. Prosecutors alleged Hayes was dishonestly seeking to manipulate the Libor rate to benefit the bank's trading positions and therefore his bonuses while ""cheating"" others trading on the market, ""motivated by pure greed"". The SFO accused Palombo of being a ""crook"" and a ""cheat"" who had ""left his moral compass at home"". The traders protested that any potential gains to their bonuses from a nudge to Libor of a maximum 0.00125% were far too little to motivate a criminal conspiracy. What they saw as the clerical task of choosing 'high' or 'low' rates based on the commercial interests of the bank - was merely what every bank had done since the 1980s, long before they started work. But according to the SFO, it was interest rate ""manipulation"" that amounted to evidence of an international conspiracy to defraud. At his 2015 trial, Hayes said he had not asked for any false answers to be given to the Libor question – but merely tried to ensure his bank selected a commercially advantageous rate from the range of accurate interest rates at which it could genuinely borrow. But the judge, Mr Justice Jeremy Cooke, decided that any attempt to take into account commercial interests when submitting a Libor rate was ""self-evidently"" unlawful. Sentencing Hayes to 14 years, he dismissed the argument that it was City practice. ""The fact that others were doing the same as you is no excuse, nor is the fact that your immediate managers saw the benefit of what you were doing and condoned and embraced it, if not encouraged it.[…] The conduct involved here must be marked out as dishonest and wrong and a message sent to the world of banking accordingly."" The defendants say court rulings retrospectively criminalised not only their actions years before, but also those of senior bankers and civil servants, much higher up the financial pecking order, who had sought to influence Libor on a much greater scale. Audio recordings, documents and data uncovered by the BBC indicate that in the 2008 financial crisis, governments and central banks from the Bank of England to the Banque de France and Banca d'Italia pressured banks to push Libor and Euribor down artificially in order to make real interest rates appear lower than they were and quell speculation about banks' solvency - a highly commercial motive. The difference, though, was that whereas the traders were asking for shifts of one hundredth of a percentage point, the central banks sought moves up to 50 times the size, giving rates that were obviously false, far away from the range of interest rates where cash was being borrowed or lent on the money markets. In a BBC Radio 4 podcast series exposing the scandal, The Lowball Tapes, Palombo asks despairingly, ""If that's not criminal, how can I be a criminal?"" Contemporary emails and phone transcripts, official interviews by the FBI and first-hand accounts of witnesses point to the involvement of top officials at Downing Street and the Treasury. They were not shown to the juries at the traders' trials. Palombo describes his life since being prosecuted as a ""Kafka nightmare"" where he could barely understand the accusations made against him, with no sense of having done anything even vaguely wrong. To him and to Hayes, one of the most serious implications is that what happened to them could happen to anyone in the workplace - to them, if normal commercial practice can be retroactively criminalised, no-one can be sure that the daily tasks they're currently engaged in at work won't, in years to come, be condemned and prosecuted. The Treasury has said it did not seek to influence individual bank Libor submissions. The Bank of England has said Libor was not regulated at the time. The Banque de France, Banca d'Italia and the Federal Reserve have declined to comment. In the traders' cases the Court of Appeal, led by judges including Lord Chief Justice John Thomas and Lord Justice Nigel Davis, blocked the path to the Supreme Court five times from 2015 to 2019. In 2021, the Criminal Cases Review Commission (CCRC) initially said it would turn down Hayes's application. But then in January 2022 a US appeal court fully acquitted two former Deutsche Bank traders, Matt Connolly and Gavin Black, saying prosecutors had failed to produce any evidence they had asked for false rates to be submitted at which their banks could not borrow. All US convictions for 'rigging' Libor were subsequently thrown out. The pair had initially been convicted in 2018 on similar charges to Hayes and Palombo. The following year, the CCRC was persuaded to change its mind. In 2024, Court of Appeal judges certified, for the first time in these cases, that there was a point of law of general public importance at stake, finally clearing the path to the Supreme Court. Two months ago, the Supreme Court heard arguments that judges in the lower courts had told juries that Hayes and Palombo's requests were wrong as a matter of law – when it should have been left as a matter of fact for the jury to decide. The SFO told the court the defendants didn't challenge the jury directions at the time. Hayes and Palombo now await the Supreme Court's judgement.","BBC",2025-05-26T02:04:07.892
73,"'Time to say goodbye': Lineker's emotional farewell on Match of the Day","Gary Lineker held back tears as he signed off from his final edition of Match of the Day after 26 years in the hot seat and officially left the BBC. The host announced in November that he would leave the football show at the end of the Premier League season, which concluded on Sunday. He had been due to remain with the BBC to front coverage of the men's FA Cup and the World Cup, but has now left the corporation completely after apologising for sharing an antisemitic social media post. On his swansong on Sunday, Lineker apparently made a nod to the controversy, opening the show by telling viewers ""it wasn't meant to end this way"" - before going on to turn the line into a reference to the final day of the season. At the end of the programme, Lineker was presented with a commemorative cap and golden boot by pundits Alan Shearer and Micah Richards, who were alongside him. ""It's been an absolute privilege to have hosted Match of the Day for a quarter of a century. It's been utterly joyous,"" he said, thanking the whole production team. Speaking directly into the camera to viewers at home, he added: ""And my final thank you goes to all of you. ""Thank you for watching, thank you for all your love and support over the years. ""It's been so special, and I'm sorry that your team was always on last. Time to say goodbye."" 'Responsible course of action' The former England forward replaced Des Lynam as the main presenter of the BBC's flagship football programme in 1999, and went on to become its highest-paid presenter. He hit the headlines for airing his opinions beyond football on social media, however. He was suspended in 2023 for a post about the then-government's asylum policy, with numerous fellow BBC Sport presenters and pundits walking out in support. After Lineker was reinstated, the BBC issued new rules for presenters posting on social media. Earlier this month, Lineker was criticised for sharing a social media post about Zionism that included an illustration of a rat, historically used as an antisemitic insult. Lineker apologised, saying he had not seen the image and ""would never consciously repost anything antisemitic"". However, it was then announced he would leave the BBC earlier than expected, and that Sunday's show would be his last. In a statement at the time, Lineker said football had been ""at the heart of my life"" and that he cared deeply about the game and his BBC work, but he recognised ""the error and upset that I caused"". ""Stepping back now feels like the responsible course of action,"" he said. BBC director general Tim Davie thanked Lineker for being ""a defining voice in football coverage for the BBC for over two decades"", and said they had ""agreed he will step back from further presenting after this season"". 'In the best of hands' Lineker's final episode in the presenter's chair on Sunday saw him interview Liverpool manager Arne Slot as they collected the Premier League trophy. Slot paid tribute, saying: ""Thank you for being such a great presenter of a BBC show that I watched many times when I lived in Holland, and now still."" The show began with a montage of former Everton and Spurs striker Lineker's goals and later looked back on highlights of his time at the helm of Match of the Day. This included him famously presenting a segment while wearing only his Leicester City boxer shorts, as he had promised, after his boyhood team won the Premier League in 2016. His longstanding sidekicks Shearer and Richards also paid tribute, introducing a montage that included testimonies from the likes of Alan Hansen, Ian Wright and Paul Gascgoine as well as the late Johan Cruyff, singer Andrea Bocelli and Lineker's sons. ""You don't believe it but you will be missed,"" offered Manchester City manager Pep Guardiola, while Liverpool captain Virgil Van Dijk described the outgoing host as ""a legend."" ""You've been great to me and you've been unbelievable to Match of the Day,"" added Shearer. ""So whatever you choose to do on Saturdays, good luck, and we'll miss you."" In January, it was revealed that Kelly Cates, Mark Chapman and Gabby Logan would jointly take over Match of the Day presenting responsibilities from the start of the 2025-26 season. ""I'd like to wish Gabby, Mark and Kelly all the very best when they sit in this chair,"" Lineker said. ""The programme is in the best of hands.""","BBC",2025-05-26T02:37:47.730
87,"Nippon Steel declines to comment on Trump's remarks over US Steel deal","Japanese steelmaker Nippon Steel has declined to comment on US President Donald Trump's remarks about its plan to acquire US Steel. Trump said on Sunday that US Steel will remain under American control after its deal with Nippon Steel. He also said the Japanese company will have ""partial ownership."" Japan's top government spokesperson, Hayashi Yoshimasa, told reporters on Monday that the government is aware of Trump's remarks but will wait for an official announcement from Washington on the issue. Hayashi also said private-sector parties are studying and coordinating a concrete investment plan. He added that the government will work to facilitate communication among the relevant parties as necessary.","NHK",2025-05-26T08:26:40
92,"Honda plans to increase hybrid vehicle production in US in response to tariffs","Japan's Honda Motor has said it plans to increase production of hybrid vehicles in the United States. Hybrid models are becoming popular in that country. Honda produces about 250,000 cars a year at a factory in the US mid-western state of Indiana. Hybrid cars account for 60 percent of cars produced at the factory. Honda expects that hybrid cars will become more popular in the US, and plans to strengthen production at the factory, including increasing the number of models. The automaker also plans to expand procurement of US-made vehicle parts, in light of tariff measures by President Donald Trump's administration. Honda's plant manager Shimizu Daisuke said the company is focusing on maximizing production of hybrid cars, for which demand is expected to increase further in North America. He also said that the company is building an optimal production system while monitoring US tariff policies. Automakers are reviewing their production systems and sales strategies due to a slowdown in sales of electric vehicles, in addition to the Trump administration's tariff measures.","NHK",2025-05-25T21:28
2,"US Steel «будет под контролем США» — Трамп намекает на частичное поглощение со стороны Nippon Steel","Вашингтон, 25 мая (Jiji Press) -- Президент США Дональд Трамп заявил журналистам 25 мая, что United States Steel Corp., которую японская Nippon Steel Corp. стремится полностью приобрести, «будет под контролем Соединенных Штатов». Говоря о плане покупки американского сталелитейного гиганта US Steel японской Nippon Steel, Трамп заявил: «Не знаю, каким будет окончательный результат, но это инвестиция и частичное владение, а контроль останется у Соединенных Штатов». Хотя Nippon Steel стремится к полному поглощению, президент намекнул на возможность ограничиться разрешением на приобретение лишь части акций. Трамп подчеркнул: «(US Steel) останется под контролем США. Иначе я не позволю этой сделке состояться». Он дал положительную оценку: «(Nippon Steel) собирается инвестировать миллиарды долларов в сталелитейную отрасль. Это хорошая компания». Эти комментарии прозвучали после того, как Трамп 23 мая выразил в социальных сетях намерение поддержать «запланированное партнерство» между Nippon Steel и US Steel. В том же посте он заявил, что возможные инвестиции принесут США экономический эффект в 14 миллиардов долларов (около 2 триллионов йен). Однако он не уточнил, одобрит ли план поглощения, и не раскрыл детали партнерства. [Авторское право The Jiji Press, Ltd.]","nippon.com",2025-05-26T14:30:45
3,"Японская полиция арестовала 16-летнего подростка из мошеннической группировки, базирующейся в Мьянме","Нагоя, 24 мая (Jiji Press) -- Японская полиция арестовала 16-летнего подростка за предполагаемые мошеннические звонки в качестве члена базирующейся в Мьянме мошеннической группировки, стало известно 24 мая. В связи с делом о мошенничестве, базирующемся в Мьянме, полиция префектуры Айти арестовала подростка (16 лет), который был защищен властями соседнего Таиланда и вернулся на родину, по подозрению в мошенничестве за участие в качестве исполнителя звонков. По данным отдела по расследованию организованной преступности, подросток — ученик старшей школы из района Мидзухо города Нагоя в центральной Японии. Он не явился на запланированный на 19 мая добровольный допрос, и его местонахождение стало неизвестным. Когда полиция префектуры разыскивала его, 23 мая он был обнаружен в префектуре Сайтама. Из-за опасений, что он может скрыться, расследование было переведено в принудительный режим. Подросток обвиняется в том, что 14 января в сговоре с подозреваемыми Исикава Сёки (32) и Яти Томонари (22), оба безработные и повторно арестованные по другому обвинению в мошенничестве, выдавая себя за полицейского из полиции префектуры Айти, позвонил на мобильный телефон мужчины из префектуры Миэ, находившегося в командировке в американском штате Орегон, сообщив: «Ваш счет используется для преступлений», и обманом заставил перевести 9,9 миллиона йен. По данным отдела, в начале декабря прошлого года подросток был завербован через Telegram мужчиной, который сказал: «Есть работа, где можно развить навыки программирования», и въехал в Мьянму через Таиланд. На базе под руководством азиатского координатора он участвовал в мошенничестве в качестве исполнителя звонков вместе с примерно 8 японцами, включая подозреваемого Исикава, но в середине февраля этого года был защищен и вернулся на родину. [Авторское право The Jiji Press, Ltd.]","nippon.com",2025-05-26T14:29:42
4,"Режиссер Сэто Момоко получила Международную премию критиков за анимационный фильм на Каннском кинофестивале","Канны, Франция, 24 мая (Jiji Press) -- Анимационный фильм японского режиссера Сэто Момоко «Одиссея одуванчика» был удостоен премии Международной федерации кинокритиков на 78-м Каннском международном кинофестивале 24 мая. Режиссер Сэто — уроженка Токио. Призёрская работа представляет собой франко-бельгийскую продукцию, рассказывающую без диалогов о семенах одуванчика, которые путешествуют по вселенной, пережив ядерный взрыв. Картина была показана заключительным фильмом «Недели критиков», проходящей параллельно с основным кинофестивалем. Обосновывая награду, Международная федерация кинокритиков высоко оценила «великолепный монтаж Сэто и уникальную технику изображения, сочетающую формы классической и современной анимации». Федерация, известная как Фипрески, заявила: «Мы выбрали этот фильм за великолепный монтаж и использование особых техник изображения, которые сочетают классические и современные формы анимации». Федерация также наградила еще два фильма. Тем временем «Золотая пальмовая ветвь» этого года досталась иранскому режиссеру-диссиденту Джафару Панахи за картину «Простая авария». Фильм «Ренуар» режиссера Хаякава Тиэ, единственный японский номинант, остался без главного приза. [Авторское право The Jiji Press, Ltd.]","nippon.com",2025-05-26T14:28:29
