ID,Title,Content,Source,PublishedAt
58,"ИНТЕРВЬЮ: Трамп не вернет пошлины на японские автомобили к прежнему уровню","Нью-Йорк, 16 мая (Jiji Press) -- Пошлины на японские автомобили, повышенные при администрации президента США Дональда Трампа, вряд ли вернутся к прежнему уровню даже после проведения переговоров, считает ведущий экономист. Учитывая масштаб торгового дефицита США в автомобильной отрасли с Японией, американская администрация вряд ли пойдет на существенное снижение пошлин, заявил Штефан Ангрик, старший экономист токийского офиса Moody’s Analytics, в недавнем интервью Jiji Press. Соединенные Штаты остаются крупнейшим экспортным рынком для Японии, причем автомобильная продукция составляет около 30% всего японского экспорта в США. В апреле американское правительство ввело дополнительную 25-процентную пошлину на импортные автомобили. В связи с тем, что ранее в этом месяце правительство США согласилось снизить пошлины на британские автомобили, Ангрик предполагает, что администрация Трампа может пойти на подобные уступки и в отношении других стран. По мнению экономиста, хотя пошлины на японские автомобили могут быть снижены примерно до 10%, возвращение к докризисному уровню в 2,5% практически исключено, поскольку Трамп продолжает отдавать приоритет политике возвращения производств на территорию США. Комментируя требования Японии о пересмотре всего комплекса тарифных мер, Ангрик отметил наличие «серьезных разногласий между правительствами, что может значительно затянуть переговорный процесс». По его прогнозам, маловероятно введение полной 24-процентной пошлины, включающей временно приостановленные дополнительные сборы, однако базовая ставка в 10% сохранится. [Авторское право The Jiji Press, Ltd.]","nippon.com",2025-05-20T14:58:11
59,"Роботы-курьеры проходят испытания в магазинах Seven-Eleven Japan","Токио, 19 мая (Jiji Press) -- Сеть круглосуточных магазинов Seven-Eleven Japan приступила 19 мая к тестированию доставки товаров с помощью роботов на дорогах общего пользования в западном пригороде Токио. Этот шаг предпринят на фоне острой нехватки водителей-курьеров. Экспериментальный проект охватывает два магазина в городе Хатиодзи, где в каждой торговой точке задействованы по два робота. Они доставляют товары, заказанные клиентами через приложение 7NOW, после того как сотрудники магазина вручную загружают продукты. Четырехколесные роботы в форме коробки передвигаются по тротуарам со скоростью до 6 километров в час, автоматически соблюдая сигналы светофора и объезжая препятствия. Тестирование продлится до февраля следующего года, после чего Seven-Eleven Japan оценит перспективы внедрения роботизированной службы доставки. Ожидается, что новая технология поможет решить проблему нехватки водителей и улучшит обслуживание пожилых покупателей, которым сложно самостоятельно посещать магазины. Для пользования сервисом клиентам необходимо предварительно зарегистрировать в приложении данные кредитной карты и другую информацию. [Авторское право The Jiji Press, Ltd.]","nippon.com",2025-05-20T14:56:51
60,"В Японии принят закон о цифровизации уголовного судопроизводства","Токио, 16 мая (Jiji Press) -- Парламент Японии одобрил 16 мая пакет законопроектов, направленных на цифровизацию уголовного судопроизводства, включая возможность получения электронных ордеров на арест и обыск. Законы были приняты в верхней палате парламента благодаря поддержке правящей Либерально-демократической партии и основной оппозиционной Конституционно-демократической партии Японии. Ключевым нововведением станет электронная система выдачи ордеров, позволяющая следственным органам подавать запросы и получать документы в режиме онлайн. Ожидается, что обновленное законодательство вступит в силу до конца 2026 финансового года. До настоящего времени полицейским требовалось лично являться в суд для получения ордеров, что создавало временные ограничения даже в срочных случаях. С введением новой системы сотрудники правоохранительных органов смогут запрашивать ордера онлайн, получать их в электронном формате и предъявлять на экранах планшетов при проведении следственных действий. Помимо этого, судебная документация также будет переведена в цифровой формат, что позволит адвокатам знакомиться с материалами дела удаленно, без необходимости посещения суда. [Авторское право The Jiji Press, Ltd.]","nippon.com",2025-05-20T14:54:14
64,"Fears over hazardous spill after cargo ship capsizes off coast of India","Authorities in India's southern Kerala state have issued an alert after a ship carrying oil and hazardous cargo leaked and sank off the state's coast in the Arabian Sea. The spill occurred in a Liberian-flagged vessel that capsized near Kochi city on Sunday. The coastal stretch is rich in biodiversity and is also an important tourist destination. All 24 crew members on board the ship have been rescued but some of the ship's 640 containers have reportedly been drifting towards the shore, prompting evacuations in the area. Authorities fear that oil, fuel and other harmful substances that have leaked from the ship and its cargo could endanger the health of residents and marine life. ""As the oil slick can reach anywhere along the Kerala coast, an alert has been sounded across the coastal belt,"" a statement from the chief minister's office said. Authorities have advised residents living near the sea to not touch any containers or the oil that might wash up to the shore, while fishermen have been asked to avoid venturing too close to the sunken ship. On Monday, officials said they had intensified pollution control measures to contain the spill. The Indian Coast Guard has deployed a ship carrying pollution control equipment to the site. It has also sent one of its aircraft which has an oil spill detection system to survey the area. The vessel - MSC ELSA 3 - which was travelling from Vizhinjam port to Kochi, began to tilt dangerously when it was about 38 nautical miles from the coast of Kochi. It capsized into the Arabian Sea in the early hours of Sunday due to flooding in one of its compartments. The Indian Coast Guard said that the ship was carrying 13 containers of hazardous cargo and 12 with calcium carbide - a chemical that reacts with seawater to release a flammable gas. ""Additionally, [the] ship had 84.44 metric tonnes of diesel and 367.1 metric tonnes of furnace oil in its tanks,"" it said. The crew members were rescued by Indian navy personnel after an hours-long operation.","BBC",2025-05-26T11:36:44.755
77,"Trump delays 50% tariff on EU until July 9","US President Donald Trump says he has extended the deadline for imposing a 50-percent tariff on the European Union. He says the date will be moved back by more than a month to give more time to negotiators to work out a deal. Trump told reporters that he spoke on the phone with European Commission President Ursula von der Leyen. ""We had a very nice call, and I agreed to move it. I believe July 9 would be the day that she requested."" He added, ""She said we will rapidly get together and see if we can work something out."" Trump on Friday made the threat to impose the 50-percent tariff on goods from the EU. He complained on social media that negotiations with the bloc had ""gone nowhere."" The US president said the annual US trade deficit with the EU is massive and ""totally unacceptable.""","NHK",2025-05-26T06:47:27
78,"Japan PM Ishiba seeks US tariff agreement with G7 summit in mind","Prime Minister Ishiba Shigeru has indicated he will proceed with talks with the United States over tariff measures while seeking an agreement between leaders on the sidelines of next month's G7 summit. Ishiba exchanged opinions with senior shipbuilding officials in Maizuru City, Kyoto Prefecture, on Sunday. Ishiba said, ""I would appreciate it very much if we can discuss what is possible through Japan-US cooperation and what advantages can come from this."" High-level negotiations between Japan and the US took place on Friday. Japan has already proposed using domestic shipbuilding expertise to repair US military vessels in Japan. Ishiba said: ""The US is interested to see if US military vessels can be repaired in Japan. If possible, we are willing to offer support in this area."" He also said his government will consider promoting cooperation regarding ice-breaking ships that travel in the Arctic Circle. Opposition party leaders gave their views on the issue. Constitutional Democratic Party of Japan President Noda Yoshihiko said, ""The G7 is very important as it includes Canada and other countries that export automobiles to the US."" Democratic Party for the People President Tamaki Yuichiro said he wants the government to hold the negotiations in a strategic manner to bring benefits to both countries. Economic Revitalization Minister Akazawa Ryosei returned to Japan on Sunday afternoon after the latest round of high-level negotiations with the US. Akazawa said both sides discussed various issues, such as trade expansion, non-tariff measures and economic security cooperation. He expressed hope to hold another round of talks as soon as possible with US Treasury Secretary Scott Bessent, who was absent from the latest round. Akazawa says Japan and the US had already reached a consensus to hold intensive consultations in May or later. He says he wants to hold more talks with the US at a time convenient for both sides.","NHK",2025-05-25T16:14
79,"Japan to sell stockpiled rice to retailers directly","Japan's agriculture ministry says it will start selling government stockpiles of rice directly to retailers, so the grain can reach consumers at lower prices. The plan follows a series of competitive auctions that failed to bring down soaring prices of the staple crop. Ministry officials say the stockpiles will now be released through no-bid contracts with major retailers, including e-commerce platforms, that can handle rice in bulk. A total of 300,000 tons from 2021 and 2022 will be up for sale. Prices will be set at roughly half the level of the average winning bids from the recent auctions. That means the retailers will pay 963 yen, or about 6.7 dollars, for a 5-kilogram bag. With distribution costs included, the retail price before tax is likely to be around 2,000 yen, or about 14 dollars. Earlier this month, supermarkets across Japan had been selling the same volume of rice at an average price of over 4,000 yen. The ministry is accepting applications from retailers from Monday. Officials say the rice could hit store shelves in early June at the earliest. Minister Koizumi Shinjiro spoke at the inaugural meeting of a taskforce implementing the plan. He said, ""Without doubt, the top priority for the agriculture ministry is to stabilize rice prices. We face the urgent challenge of delivering low-priced, tasty rice to consumers as quickly as possible to prevent consumers from shying away from the staple food. This is our responsibility."" The taskforce will eventually have about 500 members in total, including personnel from regional bureaus.","NHK",2025-05-26T09:38
80,"Chinese fighter jets take off from, land on aircraft carrier off Senkaku Islands","Japan's Defense Ministry announced on Sunday that the Chinese Navy's aircraft carrier Liaoning sailed in the East China Sea off the coast of the Senkaku Islands in Okinawa Prefecture. The ministry says fighter jets took off from the carrier and landed on it. The ministry said Liaoning and four other ships were confirmed to be sailing in the ocean about 200 kilometers north of Kubashima Island at around 7 a.m. on Sunday. It said fighter jets and helicopters were confirmed taking off and landing on the Liaoning. The Japan Air Self-Defense Force scrambled fighter jets. There was no violation of Japan's airspace. This is the first time the defense ministry has announced takeoffs and landings of fighter jets using a Chinese aircraft carrier sailing in the East China Sea. The ministry said Japan is going through diplomatic channels to express interest in the recent stepped-up activities of the Chinese military. On May 3, a China Coast Guard helicopter violated Japan's territorial airspace around the Senkaku Islands, and the ministry continues surveillance in the area. Japan controls the Islands. China and Taiwan claim them. The Japanese government maintains the islands are an inherent part of Japan's territory, in terms of history and international law. It says there is no issue of sovereignty to be resolved over them.","NHK",2025-05-25T17:44
82,"Another North Korean official detained over failed destroyer launch","A North Korean media outlet says the country's law-enforcement authorities have detained another official in connection with last week's failed launch of a warship. The ruling Workers' Party newspaper, Rodong Sinmun, reported on Monday that the deputy head of the Munitions Industry Department of the party's Central Committee had been detained. The paper says the action was based on data from an investigation team, adding that the deputy head is greatly responsible for the accident. The destroyer was damaged during its launch ceremony on Wednesday at a shipyard in the country's northeast. Three officials have already been detained over the accident. Satellite imagery shows the partially submerged warship lying on its side with many other vessels around it. North Korean media said work is being carried out to restore the ship's balance. The country's leader, Kim Jong Un, criticized the accident as a criminal act. He said the irresponsible errors of senior officials will be raised at the Central Committee's plenary meeting scheduled for late June.","NHK",2025-05-26T06:20
83,"Trump expects 'good news' from US-Iran nuclear talks","US President Donald Trump says he is expecting ""good news"" from talks with Iran over its nuclear development. Trump made the remark after delegations from the two countries held the fifth round of high-level talks in Rome, Italy, on Friday. The delegations, led by US Special Envoy to the Middle East Steve Witkoff and Iranian Foreign Minister Abbas Araghchi, expressed the view that they had made some progress in the talks. Speaking to reporters in New Jersey on Sunday, Trump said: ""We had very good talks with Iran yesterday and today, and let's see what happens. But I think we could have some good news on the Iran front."" He added: ""I don't know if I will be telling you anything good or bad over the next two days, but I have a feeling I might be telling you something good. We've had some real progress, serious progress."" Trump is apparently seeking a quick diplomatic win over Iran's nuclear development, as ceasefire talks regarding the Gaza Strip and Ukraine have stalled. But it remains unclear to what extent the US and Iran have narrowed their differences over Iran's uranium enrichment, which has been a point of contention between the two.","NHK",2025-05-26T07:52
84,"Trump says he doesn't like 'what Putin is doing' in Ukraine","US President Donald Trump has expressed strong distrust in Russian President Vladimir Putin after Moscow launched massive attacks across Ukraine. Trump told reporters on Sunday: ""I'm not happy with what Putin is doing. He's killing a lot of people, and I don't know what the hell happened to Putin."" He went on to say: ""I've known him a long time. Always gotten along with him, but he's sending rockets into cities and killing people, and I don't like it at all."" Trump did not rule out the possibility of imposing additional sanctions against Russia. Ukraine and Russia completed a three-day exchange of 1,000 prisoners each through Sunday. The swap was based on an agreement reached during direct talks in Turkey. Russia conducted air strikes against Ukraine from Saturday night into Sunday with 298 drones and 69 missiles. Reuters news agency said it was ""the largest aerial attack"" since Russia began its invasion. In phone talks with Trump last week, Putin did not agree to an immediate ceasefire. Trump said later that he was ready to step back from the negotiations between Ukraine and Russia if he saw there was no progress. He also said, ""This is not my war.""","NHK",2025-05-26T07:40
86,"Scholar's note on secret Japan-US nuclear pact to be donated to Okinawa","A scholar's note related to a secret nuclear pact on Okinawa's reversion from US rule will be donated to the prefecture. The five-page missive by Wakaizumi Kei is dated June 23, 1994, and addressed to the people of Okinawa. The prefecture recognizes June 23 as the final day of organized combat there in the closing days of World War Two. It holds a commemorative event every year. Wakaizumi, born in Fukui Prefecture, central Japan, served as a secret envoy of then-Prime Minister Sato Eisaku and negotiated with US officials separately from the Foreign Ministry on the 1972 reversion. In a book he published in 1994, the professor of international politics disclosed that the two countries had a secret deal that the US would withdraw nuclear weapons from Okinawa, but would have the right to reintroduce them in times of crisis. Wakaizumi is said to have felt huge responsibility for the heavy concentration of US military facilities in Okinawa. In the note, he said he will take his own life to fulfill his accountability for history. He died two years later. The note's owner, a friend of Wakaizumi living in Fukui, has proposed formally donating the document to Okinawa on the 80th anniversary year of the end of World War Two. The note will be displayed at the Okinawa Prefectural Archives after September.","NHK",2025-05-26T10:44
88,"Japanese companies adopting AI for training, evaluation","Businesses in Japan are expanding their use of generative artificial intelligence to human-resources management, including staff training and evaluation. A subsidiary of precision-machinery maker, Ricoh, started using generative AI this year to train new recruits in sales work. Staff wear goggles as they pitch the company's products to AI-generated clients, and AI also evaluates their performance. Kawamura Koji of Ricoh Japan said ""This will allow for a significant increase in role-playing and as a result, our staff will be able to communicate better with customers, and listen to their problems as much as possible. Cable-TV operator JCOM plans to introduce AI to evaluate call-center staff by next March. AI will analyze interactions between employees and customers for criteria such as clarity of staff explanations, and estimate how the customers are feeling. A call-center manager said past evaluations were based on assessment of only about 2 percent of conversations, but AI can analyze all staff-client interactions. She said the technology will help the company grow.","NHK",2025-05-26T06:44
89,"Japan eyes further tariff talks with US to reach agreement at G7","Japan's Prime Minister Ishiba Shigeru has indicated that he plans to proceed with tariff negotiations with the United States, aiming to reach some kind of agreement with US President Donald Trump on the sidelines of next month's G7 summit. Ishiba met with Economic Revitalization Minister Akazawa Ryosei, chief negotiator in the tariff talks, on Sunday. Akazawa had just returned to Japan after meeting senior officials in Washington, including US Trade Representative Jamieson Greer. The prime minister was briefed on what was discussed in the latest round of the bilateral negotiations. Earlier, Ishiba said that the Japanese delegation would continue discussions with its US counterpart with the upcoming G7 summit in mind. The meeting of G7 leaders is scheduled for mid-June in Canada. Ishiba also said that his government is considering promoting cooperation on the repair of US military vessels in Japan and on icebreakers used for navigation in the Arctic and other purposes. In the bilateral trade negotiations, Japan has proposed drawing up a plan to advance cooperation in the ship-building sector. US Treasury Secretary Scott Bessent was absent from the latest round of talks. Akazawa said that the two countries had already agreed to have intensive discussions in mid-May or later. He added that he hopes they can hold talks at a time that is convenient for both sides. The government expects talks involving Akazawa and Bessent to take place as early as later this week.","NHK",2025-05-26T05:13
90,"Okinawa police arrest US Marine allegedly involved in hit-and-run accident","Police officers in Okinawa have arrested a US Marine who is believed to have been involved in a hit-and-run accident in the southern Japanese prefecture. The officers say 20-year-old Marine Lance Corporal Ivan Garciamartinez is stationed at the Marine Corps' Camp Hansen. They say he was driving a car that collided with another passenger vehicle in Naha City at around 10:30 a.m. on Sunday. Four people in the passenger car, including a 7-year-old boy and a 10-year-old girl, sustained minor injuries. Garciamartinez allegedly abandoned the car and fled the scene. The police officers searched for the suspect in nearby areas. They spotted the US serviceman and arrested him about one hour after the accident. The suspect told investigators that he did cause the crash, but he denied some of the allegations. He claimed that he did not fail to provide first-aid. The police officers say the suspect's alcohol level was about double the legal limit. Investigators suspect he was driving under the influence of alcohol.","NHK",2025-05-26T01:48
